{
  "schema": "urn:algaguard:schema:onboarding:credential-csr-submission:v1",
  "schemaVersion": "1.0.0",
  "deviceUuid": "aaaaaaaa-aaaa-4aaa-8aaa-aaaaaaaaaaaa",
  "deviceId": "AG-000001",
  "purpose": "INITIAL",
  "rotationId": null,
  "idempotencyKey": "33333333-3333-4333-8333-333333333333",
  "keyAlgorithm": "EC_P256",
  "csrPem": "-----BEGIN CERTIFICATE REQUEST-----\nU0lNVUxBVEVELUNFUlRJRklDQVRFLVNJR05JTkctUkVRVUVTVC1QVUJMSUMtQllURVM=\n-----END CERTIFICATE REQUEST-----\n"
}
